{
  "$schema": "https://json-schema.org/draft/2020-12/schema",
  "title": "KdpPipelineState",
  "type": "object",
  "additionalProperties": false,
  "properties": {
    "project": {
      "type": "object",
      "additionalProperties": false,
      "properties": {
        "title": { "type": "string", "minLength": 1 },
        "niche": { "type": "string" },
        "language": { "type": "string", "minLength": 2 },
        "tone": { "type": "string" },
        "persona": { "type": "string", "enum": ["dev", "pen", "unknown"] }
      },
      "required": ["title", "language", "persona"]
    },
    "workflow": {
      "type": "object",
      "additionalProperties": false,
      "properties": {
        "phase": { "type": "string" },
        "criticThresholdScore": { "type": "number", "minimum": 0, "maximum": 10 },
        "blockSeverities": {
          "type": "array",
          "items": { "type": "string", "enum": ["OK", "BASSO", "MEDIO", "ALTO", "CRITICO"] },
          "minItems": 1
        }
      },
      "required": ["phase", "criticThresholdScore", "blockSeverities"]
    },
    "quality": {
      "type": "object",
      "additionalProperties": false,
      "properties": {
        "last": {
          "type": "object",
          "additionalProperties": true,
          "properties": {
            "moduleId": { "type": "string" },
            "score": { "type": "number", "minimum": 0, "maximum": 10 },
            "severity": { "type": "string", "enum": ["OK", "BASSO", "MEDIO", "ALTO", "CRITICO"] }
          },
          "required": ["moduleId", "score", "severity"]
        },
        "history": {
          "type": "array",
          "items": {
            "type": "object",
            "additionalProperties": true,
            "properties": {
              "moduleId": { "type": "string" },
              "score": { "type": "number", "minimum": 0, "maximum": 10 },
              "severity": { "type": "string", "enum": ["OK", "BASSO", "MEDIO", "ALTO", "CRITICO"] },
              "at": { "type": "string", "minLength": 10 }
            },
            "required": ["moduleId", "score", "severity", "at"]
          }
        }
      }
    },
    "artifacts": {
      "type": "object",
      "additionalProperties": true,
      "properties": {
        "canonicalMarkdownPath": { "type": "string" },
        "kdpMarkdownPath": { "type": "string" },
        "pdfStablePath": { "type": "string" },
        "coversDir": { "type": "string" },
        "previewImagesDir": { "type": "string" }
      }
    }
  },
  "required": ["project", "workflow"]
}

